[
  {
    "id": "accounting-erp",
    "name": "Accounting and ERP",
    "description": "Invoicing, bookkeeping and connected business operations.",
    "audience": "Business owners, finance teams and bookkeepers across industries",
    "audienceReach": "broad",
    "audienceRationale": "Financial record keeping spans business sizes and sectors; finance users operate software directly.",
    "audienceSources": [
      "https://quickbooks.intuit.com/pricing/",
      "https://www.xero.com/us/pricing-plans/"
    ],
    "audienceRank": 20,
    "parent": null
  },
  {
    "id": "api-testing",
    "name": "API clients and testing",
    "description": "Develop, inspect and automate tests for HTTP and other APIs, with explicit separation between local clients and managed team platforms.",
    "audience": "Software developers, API QA engineers and technical integration teams",
    "audienceReach": "specialist",
    "audienceRationale": "Daily utility for API development and quality assurance roles; narrower than general business collaboration tools.",
    "audienceSources": [
      "https://www.postman.com/pricing/",
      "https://insomnia.rest/pricing"
    ],
    "audienceRank": 47,
    "parent": null
  },
  {
    "id": "automation",
    "name": "Workflow automation",
    "description": "Connect business apps and automate multi-step processes with triggers, actions and orchestration.",
    "audience": "Business operations, sales, marketing, IT and other teams connecting everyday applications.",
    "audienceReach": "broad",
    "audienceRationale": "Cross-department workflow integration; relevant across industries, but requires processes that benefit from automation.",
    "audienceSources": [
      "https://zapier.com/pricing",
      "https://www.make.com/pricing"
    ],
    "audienceRank": 32,
    "parent": null
  },
  {
    "id": "backup-recovery",
    "name": "Backup and recovery",
    "description": "Create recoverable file backups and restore lost data; distinguish managed endpoint services from self-operated backup tools and full-system disaster recovery.",
    "audience": "Individuals protecting computer files and IT teams operating endpoint or server backups.",
    "audienceReach": "broad",
    "audienceRationale": "File loss and device failure affect personal and business computing; operation of server repositories requires technical administration.",
    "audienceSources": [
      "https://www.backblaze.com/cloud-backup/business",
      "https://restic.net/",
      "https://kopia.io/"
    ],
    "audienceRank": 8,
    "parent": null
  },
  {
    "id": "business-intelligence",
    "name": "Business intelligence",
    "description": "Database exploration, metrics, dashboards and scheduled analytical reporting.",
    "audience": "Business analysts, data teams, managers and operational teams consuming business metrics.",
    "audienceReach": "broad",
    "audienceRationale": "Reporting supports many business functions; configuration and semantic modeling are concentrated in analysts and data teams.",
    "audienceSources": [
      "https://www.microsoft.com/en-us/power-platform/products/power-bi/pricing",
      "https://www.tableau.com/pricing",
      "https://cloud.google.com/looker/pricing",
      "https://www.metabase.com/blog/making-bi-migration-suck-less"
    ],
    "audienceRank": 38,
    "parent": null
  },
  {
    "id": "crm",
    "name": "CRM",
    "description": "Manage contacts, sales opportunities, pipelines, and customer relationships.",
    "audience": "Sales teams, account managers, founders, and customer-facing staff across industries.",
    "audienceReach": "broad",
    "audienceRationale": "Cross-industry sales and customer operations, from small businesses to enterprise teams; less universal than email or file storage.",
    "audienceSources": [
      "https://www.hubspot.com/pricing/sales",
      "https://www.salesforce.com/sales/pricing/"
    ],
    "audienceRank": 23,
    "parent": null
  },
  {
    "id": "diagramming",
    "name": "Diagramming",
    "description": "Create flowcharts, process maps, technical diagrams and visual documentation.",
    "audience": "Business teams, educators, engineers and developers communicating processes and systems.",
    "audienceReach": "broad",
    "audienceRationale": "Process and system diagrams span business, technical and education work; creation is an occasional or specialist task for many users.",
    "audienceSources": [
      "https://www.drawio.com/docs/about/",
      "https://mermaid.js.org/intro/",
      "https://lucid.co/lucidchart/trial"
    ],
    "audienceRank": 29,
    "parent": null
  },
  {
    "id": "digital-assets",
    "name": "Digital Asset Management",
    "description": "Catalog, search, govern and share photos, video, brand files and other media with structured metadata and access controls.",
    "audience": "Marketing and creative teams, brand managers, media librarians, archives and cultural institutions.",
    "audienceReach": "functional",
    "audienceRationale": "A recurring function across industries, primarily used by teams managing reusable media collections rather than every employee.",
    "audienceSources": [
      "https://www.resourcespace.com/get",
      "https://www.bynder.com/en/pricing/",
      "https://www.phraseanet.com/decouvrir"
    ],
    "audienceRank": 37,
    "parent": null
  },
  {
    "id": "docs-wiki",
    "name": "Docs and wiki",
    "description": "Team documentation, internal wikis and shared knowledge workspaces.",
    "audience": "Employees and teams documenting decisions, procedures, project plans and institutional knowledge.",
    "audienceReach": "broad",
    "audienceRationale": "Documentation spans business functions; adoption does not require a specialist department. Qualitative potential reach, not a headcount estimate.",
    "audienceSources": [
      "https://www.notion.com/pricing",
      "https://www.atlassian.com/en/software/confluence/pricing"
    ],
    "audienceRank": 9,
    "parent": null
  },
  {
    "id": "document-management",
    "name": "Document Management",
    "description": "Capture, OCR, organize, search and control business documents, with document workflows and access permissions.",
    "audience": "Operations, finance, HR, records administrators and teams managing document collections.",
    "audienceReach": "broad",
    "audienceRationale": "Document capture and retrieval span business departments and industries; advanced approval and governance needs vary by organization.",
    "audienceSources": [
      "https://start.docuware.com/faq/docuware-pricing",
      "https://www.mayan-edms.com/"
    ],
    "audienceRank": 17,
    "parent": null
  },
  {
    "id": "e-signature",
    "name": "E-signature",
    "description": "Send business documents for electronic signature and track completion.",
    "audience": "Businesses sending contracts, offers, purchase agreements, waivers, and approvals.",
    "audienceReach": "broad",
    "audienceRationale": "Agreement workflows span sales, HR, procurement, operations, and customer onboarding; use varies with document volume.",
    "audienceSources": [
      "https://www.docusign.com/products/electronic-signature",
      "https://docs.opensignlabs.com/docs/API-docs/v1.2/intro/"
    ],
    "audienceRank": 15,
    "parent": null
  },
  {
    "id": "ecommerce",
    "name": "Ecommerce",
    "description": "Build online storefronts and manage catalogs, checkout, orders and commerce integrations.",
    "audience": "Online merchants and the developers or agencies building their stores.",
    "audienceReach": "functional",
    "audienceRationale": "Used across industries by businesses selling online; adoption centers on commerce operations and implementation teams.",
    "audienceSources": [
      "https://www.shopify.com/about",
      "https://prestashop.com/open-source/"
    ],
    "audienceRank": 27,
    "parent": null
  },
  {
    "id": "email-clients",
    "name": "Email clients and webmail",
    "description": "Desktop email clients and browser webmail for individual mailbox workflows.",
    "audience": "Individuals and organizations reading, organizing, and sending email across existing mail accounts.",
    "audienceReach": "universal",
    "audienceRationale": "Personal and work email spans occupations and organization sizes; desktop and browser access serve general mailbox needs. Shared customer-support operations are a separate capability.",
    "audienceSources": [
      "https://www.thunderbird.net/en-US/desktop/",
      "https://roundcube.net/about/",
      "https://help.front.com/en/articles/2054"
    ],
    "audienceRank": 2,
    "parent": null
  },
  {
    "id": "email-hosting",
    "name": "Business email hosting",
    "description": "Custom-domain mailbox servers and groupware; distinguishes email hosting from complete office suites and mail clients.",
    "audience": "Organizations operating custom-domain employee email, and IT administrators responsible for delivery and mailbox infrastructure.",
    "audienceReach": "broad",
    "audienceRationale": "Custom-domain email serves businesses across functions; self-operated server selection and ongoing delivery operations chiefly concern IT teams. Qualitative audience reach, not a counted market estimate.",
    "audienceSources": [
      "https://workspace.google.com/pricing",
      "https://www.microsoft.com/en-us/microsoft-365/business/compare-all-microsoft-365-business-products",
      "https://docs.mailcow.email/",
      "https://www.fastmail.com/pricing/us/",
      "https://www.zoho.com/mail/zohomail-pricing.html"
    ],
    "audienceRank": 40,
    "parent": null
  },
  {
    "id": "email-marketing",
    "name": "Email marketing",
    "description": "Newsletters, subscriber segmentation, campaigns and marketing automation.",
    "audience": "Businesses, charities and publishers communicating with prospects and customers.",
    "audienceReach": "broad",